"","new_line","line","month","day","protest","march.demonstration","strike","occupation","blockade","hunger.strike","location","number","police","violence","damage","organization","text"
"21",32,166,0,0,0,0,0,0,0,0,"","",0,0,0,"","Seg√∫n un informe presentado por el Banco Mundial (BM), Nicaragua es una de las √∫ltimas naciones de Am√©rica Latina donde los infantes tienen mayor acceso a los servicios b√°sicos. Este informe se basa en el √çndice de Oportunidades Humanas (OH) que mide la tasa de disponibilidad de servicios para la poblaci√≥n, con un m√°ximo de 100 puntos. Los pa√≠ses de Am√©rica Latina mejor caliÔ¨Åcados est√°n integrados por Chile (95 puntos), Uruguay (92), M√©xico (90), Costa Rica (89), Venezuela (89) y Argentina (89)."
"5",34,168,0,0,0,0,0,0,0,0,"","",0,0,0,"","De mayo a septiembre de 2010 crece en cuatro puntos porcentuales el malestar de los nicarag√ºenses por la posible reelecci√≥n del Presidente Daniel Ortega. Seg√∫n la encuesta n√∫mero 66 de la Ô¨Årma CID Gallup-Latinoam√©rica, realizada en septiembre, el 32% de los ciudadanos consultados ve ‚Äúmuy mal‚Äù la continuidad del mandatario. En mayo pr√≥ximo pasado, el 28% de los encuestados ten√≠an esa opini√≥n."
"9",40,172,0,0,0,0,0,0,0,0,"","",0,0,0,"","Donald Castillo, presidente de la Asociaci√≥n de Jubilados y Pensionados de Nicaragua (AJP), aÔ¨Årma que a pesar que existe una ley del adulto mayor que entr√≥ en vigencia el pasado 14 de septiembre, ninguno de los beneÔ¨Åcios que estipula esta legislaci√≥n est√°n alcanzando a los mayores de 60 a√±os del pa√≠s. Su organizaci√≥n har√° las presiones necesarias ante las instancias gubernamentales para alcanzar los beneÔ¨Åcios y no escatima la posibilidad de un paro."
"1",46,176,0,0,0,0,0,0,0,0,"","",0,0,0,"","A pesar de la oposici√≥n de la derecha, el Parlamento ratiÔ¨Åca este martes, en todas sus partes, el decreto presidencial 3-2010 que prorrog√≥ en sus cargos a una veintena de funcionarios con el mandato vencido hasta que la Asamblea Nacional designe a sus sucesores. La decisi√≥n es aprobada con los votos de los sandinistas y sus aliados en una breve sesi√≥n en la que los legisladores opositores rompieron el qu√≥rum tras la votaci√≥n, en protesta por la aprobaci√≥n de la versi√≥n constitucional."
"3",52,180,0,0,1,1,0,0,0,0,"Managua, Managua","100+",0,0,0,"Productores de Café","Cientos de productores de caf√© de la especie Ar√°bica de las zonas de Matagalpa, Estel√≠, Nueva Segovia y Jinotega se congregan frente a la Asamblea Nacional para pedir a los legisladores que mediante una ley proh√≠ban la siembra de caf√© Robusta que es una especie de menor calidad que el Ar√°bica. Los cafetaleros aseguran que la imagen del caf√© de Nicaragua ser√° afectada, si se contin√∫a sembrando esta variedad de caf√©, lo cual podr√≠a disminuir el precio de este rubro en el mercado internacional. El jefe de la bancada del Frente Sandinista, Edwin Castro, manifest√≥ que esa bancada apoyar√° a los productores para evitar una mezcla del caf√© Ar√°biga con el Robusta, y recomend√≥ a los productores que elaboren un proyecto de ley para ese Ô¨Ån."
"16",54,185,0,0,1,0,1,0,0,0,"Managua, Managua","",0,0,0,"Oposicion Nicaraguense","La oposici√≥n nicarag√ºense paraliza el Congreso en protesta por la ratiÔ¨Åcaci√≥n de una nueva versi√≥n constitucional con un inciso de 1989 que avala un pol√©mico decreto presidencial que prorroga en sus cargos a una veintena de funcionarios con el mandato vencido. La oposici√≥n se niega a hacer qu√≥rum con lo cual se extiende la par√°lisis que vive la Asamblea Legislativa desde hace cuatro meses debido a la pugna que mantiene con el oÔ¨Åcialismo. Los sandinistas acusan a la oposici√≥n de boicotear el trabajo del Ejecutivo en pro del desarrollo social."
"20",56,187,0,0,0,0,0,0,0,0,"","",0,0,0,"","Mar√≠a Antonia Zelaya, representante de la Agencia de Cooperaci√≥n Suiza en Nicaragua, caliÔ¨Åca como relevante el √©xito que el Programa Productivo Alimentario y otros emprendidos por el Gobierno Sandinista como estrategia de reducci√≥n de la pobreza. Sus declaraciones las realiza despu√©s de evaluar una serie de programas y proyectos promovidos por el Gobierno Sandinista."
"4",62,191,0,0,0,0,0,0,0,0,"","",0,0,0,"","Contin√∫a el II Congreso Nacional de la Juventud Sandinista con los debates de m√°s de 250 delegados sobre el compromiso de los j√≥venes con el actual proceso revolucionario llevado adelante por el FSLN. La reuni√≥n nacional est√° enmarcada tambi√©n en la conmemoraci√≥n del 43 aniversario del paso a la inmortalidad del comandante Ernesto Ch√© Guevara. Bosco Castillo, coordinador nacional de la Juventud Sandinista 19 de Julio, manifest√≥ que el objetivo fundamental es consolidar la estrategia pol√≠tica de trabajo de los j√≥venes en el territorio."
"15",68,195,0,0,0,0,0,0,0,0,"","",0,0,0,"","Fabio Gadea Mantilla, quien aspira a ser el √∫nico candidato de la oposici√≥n para las elecciones presidenciales del pr√≥ximo a√±o, fue aclamado como el candidato de la esperanza. Gadea realiza un recorrido desde el desvi√≥ la Virgen hacia el sector norte y centro de la ciudad portuaria de Corinto, Chinandega. Opositores al r√©gimen de Ortega acompa√±an al candidato de oposici√≥n en su gira. En la actividad sobresalen banderas azul y blanco de la patria, de los partidos Movimiento de Renovaci√≥n Sandinista (MRS) y del Partido Conservador (PC). Adem√°s, particip√≥ el Grupo 8 de Noviembre."
"14",75,202,0,0,1,0,0,0,1,0,"Managua, Managua","",0,0,0,"Estudiantes de la Universidad Nacional Agraria (UNA)","Estudiantes de la Universidad Nacional Agraria (UNA), mantienen desde esta ma√±ana un tranque vehicular en la carretera Panamericana Norte, en rechazo a la decisi√≥n que tom√≥ el Rector de dicha casa de estudios, Tel√©maco Talavera, de donar 45 manzanas de la Ô¨Ånca Santa Rosa, para ubicar a decenas de familias que fueron evacuadas de sus hogares a causa de las inundaciones. Los universitarios mantienen bloqueado el tr√°Ô¨Åco vehicular frente a la entrada principal de la UNA. Las instalaciones de la UNA est√°n cerca de la salida noreste de Managua, muy cerca del Aeropuerto Internacional ‚ÄúAugusto Cesar Sandino‚Äù."
"22",81,206,0,0,1,1,0,0,0,0,"Managua, Managua","",0,0,0,"Estudiantes de la Universidad Nacional Agraria (UNA)","Un grupo de estudiantes de la Universidad Nacional Agraria (UNA) amenaza con quemar las oÔ¨Åcinas de la Uni√≥n Nacional de Estudiantes de Nicaragua (UNEN) de esa casa de estudios, por el silencio de los dirigentes estudiantiles de esa organizaci√≥n ante la decisi√≥n del Rector de donar al Gobierno 45 manzanas de tierra de la Ô¨Ånca Santa Rosa. Tras conocer que las autoridades de la UNA mantienen su posici√≥n de no revocar el acuerdo Ô¨Årmado con el Gobierno, un grupo de j√≥venes se dirige hasta las oÔ¨Åcinas de UNEN para protestar por el silencio de esa organizaci√≥n."
"7",83,210,0,0,1,0,0,1,0,0,"Managua, Managua","12+",0,0,0,"Unidad Nacional de Adulto Mayor (UNAM)","Decenas de miembros de la Unidad Nacional de Adulto Mayor (UNAM) se plantan en las instalaciones centrales del Instituto Nicarag√ºense de Seguridad Social (INSS) y aseguran que no suspender√°n la huelga hasta que el presidente de esa cartera, Roberto L√≥pez, les de la fecha de entrega de las pensiones y el monto de las mismas. La protesta se extiende hasta las delegaciones del INSS ubicadas en la zona de Migraci√≥n y en Multicentro Las Am√©ricas, adem√°s de las sedes regionales ubicadas en las cabeceras departamentales del pa√≠s."
"10",85,212,0,0,1,1,0,0,0,0,"","",0,0,0,"Colectivo de Mujeres","El Colectivo de Mujeres ITZA maniÔ¨Åesta su total rechazo ante las violaciones a los derechos de las mujeres en Nicaragua. La organizaci√≥n aÔ¨Årma que han realizado tres plantones frente a los juzgados de Jinotepe y Diriamba, en donde han recibido rechazos, burlas, ofensas y amenazas de muerte por hombres de todas las edades."
"19",91,216,0,0,1,1,0,0,0,0,"","",0,0,0,"Unidad Nacional del Adulto Mayor (UNAM)","Los miembros de la Unidad Nacional del Adulto Mayor (UNAM) anuncian que ante la negativa del Instituto Nicarag√ºense de Seguridad Social (INSS) de pagarles las pensiones de vej ez reducidas se ven obligados a recrudecer sus acciones. Seg√∫n indic√≥ PorÔ¨Årio Garc√≠a, presidente de la UNAM, lo que siguen pidiendo es que se le d√© respuesta a la demanda central que plantearon para conseguir la pensi√≥n reducida de vej ez, tal como lo estipula el art√≠culo 49 de la Ley General de Seguridad Social. ‚ÄúHemos insistido desde hace tiempo y no nos dan respuesta; para nosotros es satisfactorio que nos den las pr√≥tesis, pero eso no resuelve lo fundamental que es la alimentaci√≥n y la asistencia m√©dica‚Äù, agrega el dirigente."
"2",98,223,0,0,1,0,0,0,0,1,"","",0,0,0,"Unidad Nacional del Adulto Mayor (UNAM)","Ante la negativa de las autoridades del Instituto Nicarag√ºense de Seguridad Social (INSS), de conceder audiencia a los miembros de la Unidad Nacional del Adulto Mayor (UNAM), √©stos iniciaron al mediod√≠a de ayer una huelga de hambre que durar√° hasta que el presidente de la instituci√≥n Roberto L√≥pez se digne a recibirlos. Luego de m√°s de 36 horas de haber iniciado la protesta, los adultos mayores continuaban siendo ignorados por las autoridades del INSS."
"18",100,225,0,0,0,0,0,0,0,0,"","",0,0,0,"","Los jefes del diario La Prensa muestran su desprecio por las leyes y los jueces al negarse a comparecer a la sesi√≥n de mediaci√≥n convocada por el Juzgado Cuarto de lo Laboral donde se tratar√≠a del despido ilegal que realizaron de 23 trabajadores de ese medio de difusi√≥n. Los directivos deciden no comparecer al proceso que estableci√≥ el Juzgado Cuarto de lo Laboral para seguir la causa que interpusieron los trabajadores despedidos por el simple hecho de conformar un sindicato. Quienes s√≠ se presentan son los 23 empleados cesanteados ilegalmente desde hace dos meses, los cuales se encuentran sin laborar como distribuidores de suscripciones luego que sus directivos y propietarios decidieron, sin la aprobaci√≥n del Ministerio del Trabajo (MITRAB), cesarlos en sus funciones."
"13",106,229,0,0,1,1,0,0,0,0,"Managua, Managua","",0,0,0,"Empleados de Programa Mundial de Alimentos (PMA)","Esta ma√±ana se realiza una marcha masiva de unidad contra el hambre, con el objetivo de conmemorar el D√≠a Mundial de la Alimentaci√≥n en el pa√≠s, que sali√≥ de las inmediaciones del Hotel Princess hacia la Universidad Centroamericana (UCA), donde se llev√≥ a cabo un acto de clausura. En la marcha participan varios grupos de estudiantes de los diferentes colegios de Managua, as√≠ como trabajadores de las instituciones gubernamentales que ven el tema de la seguridad alimentaria y representantes del Programa Mundial de Alimentos (PMA) en Nicaragua."
"17",108,231,0,0,0,0,0,0,0,0,"","",0,0,0,"","Las autoridades del Instituto Nicarag√ºense de Seguridad Social (INSS) deciden recibir a una delegaci√≥n de los adultos mayores, luego de tres d√≠as de paro y 24 horas en huelga de hambre."
"23",114,235,0,0,1,1,0,0,0,0,"","",0,0,0,"Alianza Patriotica (AP)","Varios partidos pol√≠ticos, movimientos y organizaciones apoyan hoy una eventual candidatura presidencial del Diputado opositor Fabio Gadea, con miras a las elecciones de noviembre de 2011, durante una manifestaci√≥n que se realiza en Masaya, al sur de Managua. Los manifestantes, convocados por la Alianza Patri√≥tica (AP), integrada por partidos, movimientos pol√≠ticos y organizaciones opositoras al Gobierno de Daniel Ortega, dan su apoyo a Gadea al t√©rmino de una marcha."
"11",121,242,0,0,0,0,0,0,0,0,"","",0,0,0,"","El Instituto Nacional de Informaci√≥n de Desarrollo (INIDE) aÔ¨Årma que en Nicaragua cerca de 186 mil personas econ√≥micamente activas se encuentran en el desempleo y otras 885 mil tienen un empleo precario. La creaci√≥n de empleo es insuÔ¨Åciente y por eso crece la migraci√≥n. Un empresario advierte que debido a que el crecimiento del PIB no est√° acorde a la generaci√≥n de empleos, el subempleo es una ‚Äúv√°lvula de escape‚Äù."
"8",127,246,0,0,1,1,0,0,0,0,"Managua, Managua","",0,0,0,"","Decenas de miembros de las asociaciones de no videntes marchan hacia la Asamblea Nacional, demandando a los diputados que aprueben una partida de 1.8 millones de c√≥rdobas en el 2011, destinados a ayudar a los m√°s de 20 mil ciegos que existen en el pa√≠s para lidiar con su discapacidad. Adem√°s demandan la reapertura del Centro Nacional de Rehabilitaci√≥n para no videntes. ‚ÄúEl a√±o pasado pedimos esa misma cantidad a la Asamblea, pero s√≥lo nos aprobaron 200 mil c√≥rdobas y esa es una cantidad m√≠nima cuando las personas que rehabilitan son del campo y se les tiene que garantizar alimentaci√≥n y transporte‚Äù, dijo Gloria Guti√©rrez, coordinadora general de las organizaciones de ciegos de Nicaragua."
"12",133,252,0,0,0,0,0,0,0,0,"","",0,0,0,"","El Movimiento por el Rescate del Sandinismo liderado por la c√©lebre ex guerrillera y actual Diputada, M√≥nica Baltodano rechaza, en un comunicado, ‚Äútodo intento de reformas a la Constituci√≥n sin consulta con el pueblo‚Äù."
"6",139,256,0,0,1,1,0,0,0,0,"Managua, Managua","",0,0,0,"Unidad Nacional de Adulto Mayor (UNAM)","Decenas de miembros de la UNAM marchan hacia la casa presidencial demandando que el Gobierno central les resolviera el caso de las pensiones reducidas de vej ez, luego que se venciera la tregua de dos semanas que pidiera el Ejecutivo para solucionar el problema. Representantes de las diferentes delegaciones del Adulto Mayor en todo el pa√≠s, detienen el tr√°Ô¨Åco en los sem√°foros de Montoya y luego marchan hacia la casa del mandatario."
